{
  "capture_id": "single_scan_with_ceiling",
  "tier": "lidar",
  "device": "iPhone Pro-class (LiDAR, via Stray Scanner)",
  "generated_at": "2026-09-28T18:12:14.730164+00:00",
  "rooms": [
    {
      "id": "room_0",
      "name": "single_scan_with_ceiling",
      "polygon": [
        [
          -4.462091874526093,
          -5.1147223555852666
        ],
        [
          -0.2571952825372925,
          -0.9463613332283102
        ],
        [
          -3.882986368891023,
          2.711209712201779
        ],
        [
          -8.087882960879824,
          -1.4571513101551776
        ]
      ],
      "walls": [
        {
          "id": "wall_0",
          "start": [
            -4.462091874526093,
            -5.1147223555852666
          ],
          "end": [
            -0.2571952825372925,
            -0.9463613332283102
          ],
          "length": {
            "value_m": 5.92084360222627,
            "ci_low_m": 5.624801422114957,
            "ci_high_m": 6.216885782337584,
            "confidence_level": 0.95
          }
        },
        {
          "id": "wall_1",
          "start": [
            -0.2571952825372925,
            -0.9463613332283102
          ],
          "end": [
            -3.882986368891023,
            2.711209712201779
          ],
          "length": {
            "value_m": 5.150163779361849,
            "ci_low_m": 4.8926555903937565,
            "ci_high_m": 5.407671968329941,
            "confidence_level": 0.95
          }
        },
        {
          "id": "wall_2",
          "start": [
            -3.882986368891023,
            2.711209712201779
          ],
          "end": [
            -8.087882960879824,
            -1.4571513101551776
          ],
          "length": {
            "value_m": 5.92084360222627,
            "ci_low_m": 5.624801422114957,
            "ci_high_m": 6.216885782337584,
            "confidence_level": 0.95
          }
        },
        {
          "id": "wall_3",
          "start": [
            -8.087882960879824,
            -1.4571513101551776
          ],
          "end": [
            -4.462091874526093,
            -5.1147223555852666
          ],
          "length": {
            "value_m": 5.150163779361849,
            "ci_low_m": 4.8926555903937565,
            "ci_high_m": 5.407671968329941,
            "confidence_level": 0.95
          }
        }
      ],
      "openings": [
        {
          "id": "wall_0_opening_0",
          "wall_id": "wall_0",
          "type": "unknown",
          "width": {
            "value_m": 0.40141312557466247,
            "ci_low_m": 0.32141312557466245,
            "ci_high_m": 0.4814131255746625,
            "confidence_level": 0.95
          },
          "position_on_wall_m": 3.060775082506801
        },
        {
          "id": "wall_0_opening_1",
          "wall_id": "wall_0",
          "type": "unknown",
          "width": {
            "value_m": 0.5017664069683274,
            "ci_low_m": 0.4217664069683274,
            "ci_high_m": 0.5817664069683274,
            "confidence_level": 0.95
          },
          "position_on_wall_m": 4.265014459230788
        },
        {
          "id": "wall_2_opening_0",
          "wall_id": "wall_2",
          "type": "unknown",
          "width": {
            "value_m": 0.3010598441809966,
            "ci_low_m": 0.2210598441809966,
            "ci_high_m": 0.38105984418099664,
            "confidence_level": 0.95
          },
          "position_on_wall_m": 4.616250944108618
        }
      ],
      "ceiling_height": {
        "value_m": 1.8343757608984845,
        "ci_low_m": 1.8182789624760491,
        "ci_high_m": 1.85047255932092,
        "confidence_level": 0.95
      },
      "floor_area": {
        "value_m": 30.49331426345207,
        "ci_low_m": 28.053849122375905,
        "ci_high_m": 32.93277940452823,
        "confidence_level": 0.95
      },
      "damage_regions": [
        {
          "id": "damage_concealed_wall_0_opening_0",
          "surface_id": "wall_0",
          "class": "concealed_moisture_risk",
          "extent_m2": {
            "value_m": 0.0,
            "ci_low_m": 0.0,
            "ci_high_m": 0.1,
            "confidence_level": 0.95
          },
          "concealed_flag": true,
          "concealed_rule": "concealed_behind_opening"
        },
        {
          "id": "damage_concealed_wall_0_opening_1",
          "surface_id": "wall_0",
          "class": "concealed_moisture_risk",
          "extent_m2": {
            "value_m": 0.0,
            "ci_low_m": 0.0,
            "ci_high_m": 0.1,
            "confidence_level": 0.95
          },
          "concealed_flag": true,
          "concealed_rule": "concealed_behind_opening"
        }
      ],
      "scope_line_items": [
        {
          "id": "scope_damage_concealed_wall_0_opening_0",
          "surface_id": "wall_0",
          "damage_region_id": "damage_concealed_wall_0_opening_0",
          "description": "Probe opening jambs for concealed moisture (rule: concealed_behind_opening)",
          "quantity": 1,
          "unit": "each"
        },
        {
          "id": "scope_damage_concealed_wall_0_opening_1",
          "surface_id": "wall_0",
          "damage_region_id": "damage_concealed_wall_0_opening_1",
          "description": "Probe opening jambs for concealed moisture (rule: concealed_behind_opening)",
          "quantity": 1,
          "unit": "each"
        }
      ]
    }
  ],
  "stitched_plan": {
    "room_ids": [
      "room_0"
    ],
    "adjacency": [],
    "footprint_area": {
      "value_m": 30.49331426345207,
      "ci_low_m": 28.053849122375905,
      "ci_high_m": 32.93277940452823,
      "confidence_level": 0.95
    },
    "rendered_plan_path": "/Users/ubaidahmed/Documents/personal/floorPlanner/fix_loop/after/single_scan_with_ceiling_plan.png"
  },
  "drift_correction": {
    "method_used": "poses_as_is",
    "notes": "wall_method=manhattan_rect; low_confidence=False. ceiling_ok."
  }
}