{
  "capture_id": "my_kitchen",
  "tier": "photo",
  "device": "Android/iPhone handheld (native camera)",
  "generated_at": "2026-09-28T12:03:30.045190+00:00",
  "rooms": [
    {
      "id": "room_0",
      "name": "my_kitchen",
      "polygon": [
        [
          0.0,
          0.0
        ],
        [
          2.25,
          0.0
        ],
        [
          2.25,
          1.66
        ],
        [
          0.0,
          1.66
        ]
      ],
      "walls": [
        {
          "id": "wall_0",
          "start": [
            0.0,
            0.0
          ],
          "end": [
            2.25,
            0.0
          ],
          "length": {
            "value_m": 2.25,
            "ci_low_m": 2.07,
            "ci_high_m": 2.43,
            "confidence_level": 0.95
          }
        },
        {
          "id": "wall_1",
          "start": [
            2.25,
            0.0
          ],
          "end": [
            2.25,
            1.66
          ],
          "length": {
            "value_m": 1.66,
            "ci_low_m": 1.5272,
            "ci_high_m": 1.7928,
            "confidence_level": 0.95
          }
        },
        {
          "id": "wall_2",
          "start": [
            2.25,
            1.66
          ],
          "end": [
            0.0,
            1.66
          ],
          "length": {
            "value_m": 2.25,
            "ci_low_m": 2.07,
            "ci_high_m": 2.43,
            "confidence_level": 0.95
          }
        },
        {
          "id": "wall_3",
          "start": [
            0.0,
            1.66
          ],
          "end": [
            0.0,
            0.0
          ],
          "length": {
            "value_m": 1.66,
            "ci_low_m": 1.5272,
            "ci_high_m": 1.7928,
            "confidence_level": 0.95
          }
        }
      ],
      "openings": [
        {
          "id": "wall_2_opening_0",
          "wall_id": "wall_2",
          "type": "unknown",
          "width": {
            "value_m": 0.77,
            "ci_low_m": 0.6900000000000001,
            "ci_high_m": 0.85,
            "confidence_level": 0.95
          },
          "position_on_wall_m": 0.0
        }
      ],
      "ceiling_height": {
        "value_m": 2.58,
        "ci_low_m": 2.3736,
        "ci_high_m": 2.7864000000000004,
        "confidence_level": 0.95
      },
      "floor_area": {
        "value_m": 3.735,
        "ci_low_m": 3.235,
        "ci_high_m": 4.234999999999999,
        "confidence_level": 0.95
      },
      "damage_regions": [
        {
          "id": "damage_stain_0_1",
          "surface_id": "wall_0",
          "class": "water_stain",
          "extent_m2": {
            "value_m": 0.4879286024305555,
            "ci_low_m": 0.24396430121527776,
            "ci_high_m": 0.7318929036458333,
            "confidence_level": 0.95
          },
          "concealed_flag": false,
          "concealed_rule": null
        },
        {
          "id": "damage_concealed_wall_2_opening_0",
          "surface_id": "wall_2",
          "class": "concealed_moisture_risk",
          "extent_m2": {
            "value_m": 0.0,
            "ci_low_m": 0.0,
            "ci_high_m": 0.1,
            "confidence_level": 0.95
          },
          "concealed_flag": true,
          "concealed_rule": "concealed_behind_opening"
        }
      ],
      "scope_line_items": [
        {
          "id": "scope_damage_stain_0_1",
          "surface_id": "wall_0",
          "damage_region_id": "damage_stain_0_1",
          "description": "Inspect and treat dark wall patch (rule: stain_dark_patch)",
          "quantity": 0.488,
          "unit": "m2"
        },
        {
          "id": "scope_damage_concealed_wall_2_opening_0",
          "surface_id": "wall_2",
          "damage_region_id": "damage_concealed_wall_2_opening_0",
          "description": "Probe opening jambs for concealed moisture (rule: concealed_behind_opening)",
          "quantity": 1,
          "unit": "each"
        }
      ]
    }
  ],
  "stitched_plan": {
    "room_ids": [
      "room_0"
    ],
    "adjacency": [],
    "footprint_area": {
      "value_m": 3.735,
      "ci_low_m": 3.235,
      "ci_high_m": 4.234999999999999,
      "confidence_level": 0.95
    },
    "rendered_plan_path": "benchmark/h2h/our_room_c/my_kitchen_photo_plan.png"
  },
  "drift_correction": {
    "method_used": "none",
    "notes": "method=ref_rectangle; scale_source=gt_length+gt_width; photo_count=12 dir=photos. Wall CIs use tier calibration (\u00b18%)."
  }
}