{
  "capture_id": "single_room",
  "tier": "lidar",
  "device": "iPhone Pro-class (LiDAR, via Stray Scanner)",
  "generated_at": "2026-09-28T18:12:17.175803+00:00",
  "rooms": [
    {
      "id": "room_0",
      "name": "single_room",
      "polygon": [
        [
          0.9603089429221672,
          -0.9168531638563315
        ],
        [
          3.5487121258136147,
          1.6490598619872614
        ],
        [
          1.6349011344337616,
          3.579645354031217
        ],
        [
          -0.9535020484576857,
          1.0137323281876243
        ]
      ],
      "walls": [
        {
          "id": "wall_0",
          "start": [
            0.9603089429221672,
            -0.9168531638563315
          ],
          "end": [
            3.5487121258136147,
            1.6490598619872614
          ],
          "length": {
            "value_m": 3.6446866385735275,
            "ci_low_m": 3.462452306644851,
            "ci_high_m": 3.826920970502204,
            "confidence_level": 0.95
          }
        },
        {
          "id": "wall_1",
          "start": [
            3.5487121258136147,
            1.6490598619872614
          ],
          "end": [
            1.6349011344337616,
            3.579645354031217
          ],
          "length": {
            "value_m": 2.718424700597193,
            "ci_low_m": 2.582503465567333,
            "ci_high_m": 2.8543459356270526,
            "confidence_level": 0.95
          }
        },
        {
          "id": "wall_2",
          "start": [
            1.6349011344337616,
            3.579645354031217
          ],
          "end": [
            -0.9535020484576857,
            1.0137323281876243
          ],
          "length": {
            "value_m": 3.644686638573527,
            "ci_low_m": 3.4624523066448507,
            "ci_high_m": 3.8269209705022034,
            "confidence_level": 0.95
          }
        },
        {
          "id": "wall_3",
          "start": [
            -0.9535020484576857,
            1.0137323281876243
          ],
          "end": [
            0.9603089429221672,
            -0.9168531638563315
          ],
          "length": {
            "value_m": 2.718424700597193,
            "ci_low_m": 2.582503465567333,
            "ci_high_m": 2.8543459356270526,
            "confidence_level": 0.95
          }
        }
      ],
      "openings": [],
      "ceiling_height": {
        "value_m": 2.5,
        "ci_low_m": 1.5,
        "ci_high_m": 3.5,
        "confidence_level": 0.95
      },
      "floor_area": {
        "value_m": 9.907806184234833,
        "ci_low_m": 9.115181689496046,
        "ci_high_m": 10.70043067897362,
        "confidence_level": 0.95
      },
      "damage_regions": [],
      "scope_line_items": [
        {
          "id": "scope_visual_sweep",
          "surface_id": "wall_0",
          "damage_region_id": null,
          "description": "No automated damage regions; perform visual sweep",
          "quantity": 1,
          "unit": "each"
        }
      ]
    }
  ],
  "stitched_plan": {
    "room_ids": [
      "room_0"
    ],
    "adjacency": [],
    "footprint_area": {
      "value_m": 9.907806184234833,
      "ci_low_m": 9.115181689496046,
      "ci_high_m": 10.70043067897362,
      "confidence_level": 0.95
    },
    "rendered_plan_path": "/Users/ubaidahmed/Documents/personal/floorPlanner/fix_loop/after/single_room_plan.png"
  },
  "drift_correction": {
    "method_used": "poses_as_is",
    "notes": "wall_method=manhattan_rect; low_confidence=False. ceiling_coverage_insufficient: candidate ceiling height 1.25m < 1.7m (likely furniture, not ceiling) ceiling_height_unknown; CI is residential prior 1.5-3.5m not a measurement"
  }
}